{"generated_on": "2026-10-22", "notes": "Crisis strip data. Show priority-1 lines for the visitor's country first, then the global fallbacks. Every entry is needs_verification or conflicting_sources: the build environment could not open any official page, so numbers and hours were taken from search-engine results on the generation date. A human must open each source_url and ideally test each line before launch, then set verification_status and verified_on. Re-verify quarterly; helpline numbers change (see the PAPYRUS and Childline India rows).", "global_fallbacks": [{"line_id": "global-find-a-helpline", "name": "Find A Helpline", "organization": "ThroughLine", "country": "GLOBAL", "region_label": "150+ countries", "kind": "directory", "contact": {"phone": null, "phone_alt": null, "sms_number": null, "sms_keyword": null, "chat_url": "https://findahelpline.com/", "email": null, "menu_options": []}, "hours": "Directory; lines listed with their own hours", "is_24_7": null, "languages": ["many"], "audience": ["everyone"], "topics": ["suicidal-thoughts-and-behavior", "nonsuicidal-self-injury"], "priority": 1, "cost": "free", "verification_status": "needs_verification", "verified_on": null, "source_url": "https://www.iasp.info/crisis-centres/", "notes": "Verified helplines by country with phone, text, chat, and WhatsApp options.", "reviewer_notes": "Not opened; details seen in search results on 2026-10-22. Open the official page and, ideally, test the line before launch."}, {"line_id": "global-befrienders", "name": "Befrienders Worldwide directory", "organization": "Befrienders Worldwide", "country": "GLOBAL", "region_label": "32 countries (349 centres)", "kind": "directory", "contact": {"phone": null, "phone_alt": null, "sms_number": null, "sms_keyword": null, "chat_url": "https://befrienders.org/", "email": null, "menu_options": []}, "hours": "Directory", "is_24_7": null, "languages": ["many"], "audience": ["everyone"], "topics": ["suicidal-thoughts-and-behavior", "nonsuicidal-self-injury"], "priority": 2, "cost": "free", "verification_status": "needs_verification", "verified_on": null, "source_url": "https://211lifeline.org/detail.php?id=7336963", "notes": "", "reviewer_notes": "URL from directory listing; confirm it resolves."}, {"line_id": "global-iasp", "name": "IASP crisis centres directory", "organization": "International Association for Suicide Prevention", "country": "GLOBAL", "region_label": "Global", "kind": "directory", "contact": {"phone": null, "phone_alt": null, "sms_number": null, "sms_keyword": null, "chat_url": "https://www.iasp.info/crisis-centres/", "email": null, "menu_options": []}, "hours": "Directory", "is_24_7": null, "languages": ["many"], "audience": ["everyone"], "topics": ["suicidal-thoughts-and-behavior", "nonsuicidal-self-injury"], "priority": 3, "cost": "free", "verification_status": "needs_verification", "verified_on": null, "source_url": "https://www.iasp.info/crisis-centres/", "notes": "", "reviewer_notes": "Not opened; details seen in search results on 2026-10-22. Open the official page and, ideally, test the line before launch."}], "lines": [{"line_id": "us-911", "name": "Emergency services", "organization": "Local emergency services", "country": "US", "region_label": "United States", "kind": "emergency-services", "contact": {"phone": "911", "phone_alt": null, "sms_number": null, "sms_keyword": null, "chat_url": null, "email": null, "menu_options": []}, "hours": "24/7", "is_24_7": true, "languages": ["en", "interpreters"], "audience": ["everyone"], "topics": [], "priority": 1, "cost": "free", "verification_status": "verified", "verified_on": null, "source_url": "https://www.911.gov/", "notes": "Call for immediate danger to life.", "reviewer_notes": "Standard emergency number; no verification needed."}, {"line_id": "us-988", "name": "988 Suicide & Crisis Lifeline", "organization": "SAMHSA / Vibrant Emotional Health", "country": "US", "region_label": "United States", "kind": "crisis-line", "contact": {"phone": "988", "phone_alt": null, "sms_number": "988", "sms_keyword": null, "chat_url": "https://988lifeline.org/chat/", "email": null, "menu_options": ["Press 1: Veterans Crisis Line", "Press 2: Spanish", "Press 3: LGBTQI+ support for under-25s", "Text AYUDA to 988 for Spanish; type PRIDE in chat or text for LGBTQI+ support"]}, "hours": "24/7", "is_24_7": true, "languages": ["en", "es", "interpreters"], "audience": ["everyone"], "topics": ["suicidal-thoughts-and-behavior", "nonsuicidal-self-injury"], "priority": 1, "cost": "free", "verification_status": "needs_verification", "verified_on": null, "source_url": "https://988lifeline.org/faq/calling-the-988-lifeline/", "notes": "Call, text, or chat. Veterans can also text 838255.", "reviewer_notes": "Not opened; details seen in search results on 2026-10-22. Open the official page and, ideally, test the line before launch."}, {"line_id": "us-crisis-text-line", "name": "Crisis Text Line", "organization": "Crisis Text Line", "country": "US", "region_label": "United States and Puerto Rico", "kind": "crisis-text", "contact": {"phone": null, "phone_alt": null, "sms_number": "741741", "sms_keyword": "HOME", "chat_url": null, "email": null, "menu_options": []}, "hours": "24/7", "is_24_7": true, "languages": ["en", "es"], "audience": ["everyone", "teens"], "topics": ["suicidal-thoughts-and-behavior", "nonsuicidal-self-injury"], "priority": 1, "cost": "free", "verification_status": "needs_verification", "verified_on": null, "source_url": "https://www.crisistextline.org/international", "notes": "", "reviewer_notes": "Not opened; details seen in search results on 2026-10-22. Open the official page and, ideally, test the line before launch."}, {"line_id": "us-trevor", "name": "TrevorLifeline, TrevorText, TrevorChat", "organization": "The Trevor Project", "country": "US", "region_label": "United States", "kind": "crisis-line", "contact": {"phone": "1-866-488-7386", "phone_alt": null, "sms_number": "678678", "sms_keyword": "START", "chat_url": "https://www.thetrevorproject.org/get-help/", "email": null, "menu_options": []}, "hours": "24/7", "is_24_7": true, "languages": ["en"], "audience": ["lgbtq-youth-under-25"], "topics": ["suicidal-thoughts-and-behavior", "nonsuicidal-self-injury", "gender-dysphoria", "social-environment-and-identity-stress"], "priority": 1, "cost": "free", "verification_status": "needs_verification", "verified_on": null, "source_url": "https://www.thetrevorproject.org/get-help/", "notes": "", "reviewer_notes": "One outdated school listing shows limited text hours; the organisation announced 24/7 text and chat in 2019. Confirm."}, {"line_id": "us-trans-lifeline", "name": "Trans Lifeline", "organization": "Trans Lifeline", "country": "US", "region_label": "United States", "kind": "support-line", "contact": {"phone": "877-565-8860", "phone_alt": null, "sms_number": null, "sms_keyword": null, "chat_url": null, "email": null, "menu_options": []}, "hours": "Mon–Fri 10am–6pm Pacific (1–9pm Eastern); holiday closures listed on the site", "is_24_7": null, "languages": ["en", "es"], "audience": ["trans-and-questioning"], "topics": ["gender-dysphoria"], "priority": 2, "cost": "free", "verification_status": "conflicting_sources", "verified_on": null, "source_url": "https://translifeline.org/hotline/", "notes": "Peer-run; does not call emergency services without the caller's consent.", "reviewer_notes": "Official page lists weekday hours; some directories claim 24/7. Confirm current hours."}, {"line_id": "us-veterans-crisis-line", "name": "Veterans Crisis Line", "organization": "US Department of Veterans Affairs", "country": "US", "region_label": "United States", "kind": "crisis-line", "contact": {"phone": "988 then press 1", "phone_alt": null, "sms_number": "838255", "sms_keyword": null, "chat_url": "https://www.veteranscrisisline.net/", "email": null, "menu_options": []}, "hours": "24/7", "is_24_7": true, "languages": ["en"], "audience": ["veterans", "service-members", "families"], "topics": ["suicidal-thoughts-and-behavior", "nonsuicidal-self-injury", "posttraumatic-stress-disorder"], "priority": 2, "cost": "free", "verification_status": "needs_verification", "verified_on": null, "source_url": "https://988lifeline.org/faq/calling-the-988-lifeline/", "notes": "", "reviewer_notes": "Not opened; details seen in search results on 2026-10-22. Open the official page and, ideally, test the line before launch."}, {"line_id": "us-childhelp", "name": "Childhelp National Child Abuse Hotline", "organization": "Childhelp", "country": "US", "region_label": "United States", "kind": "specialist-line", "contact": {"phone": "1-800-422-4453", "phone_alt": null, "sms_number": "800-422-4453", "sms_keyword": "GO", "chat_url": "https://childhelphotline.org/", "email": null, "menu_options": []}, "hours": "24/7", "is_24_7": true, "languages": ["en", "170+ languages via interpreters"], "audience": ["children", "teens", "adults", "family"], "topics": ["child-abuse-and-neglect"], "priority": 2, "cost": "free", "verification_status": "needs_verification", "verified_on": null, "source_url": "https://childhelphotline.org/", "notes": "", "reviewer_notes": "Not opened; details seen in search results on 2026-10-22. Open the official page and, ideally, test the line before launch."}, {"line_id": "us-ndvh", "name": "National Domestic Violence Hotline", "organization": "The Hotline", "country": "US", "region_label": "United States", "kind": "specialist-line", "contact": {"phone": "1-800-799-7233", "phone_alt": null, "sms_number": "88788", "sms_keyword": "START", "chat_url": "https://www.thehotline.org/", "email": null, "menu_options": []}, "hours": "24/7", "is_24_7": true, "languages": ["en", "es", "interpreters"], "audience": ["adults", "teens"], "topics": ["partner-violence-and-adult-abuse"], "priority": 2, "cost": "free", "verification_status": "needs_verification", "verified_on": null, "source_url": "https://www.thehotline.org/", "notes": "Site has a quick-exit button; c